{
  "format_version": 2,
  "kind": "faqi-master-classification-register",
  "reviewed_at": "2026-10-11T06:19:20+00:00",
  "source_revision": "0a7fdf4ca54d2bb327dcdfc13e816da57ee9c4c2",
  "ontology": {
    "path": "docs/gongfa/cultivation-ontology-taxonomy.md",
    "sha256": "4965b8389e546eaa5ea8eb9103d252e1d1f8113959eeadc83f5edda5ba97df75"
  },
  "dependency_graph": {
    "source_path": "docs/gongfa/technology-stack.md",
    "source_sha256": "88ff3494095c2a794acf130d5d2ccc4eb4b67ccdc8c174e7ef09f35c11a450a2",
    "source_anchor": "reference-technology-stack-十六技术栈的层级结构",
    "observed_at": "2026-10-10T12:14:00Z",
    "user_confirmation": {
      "reviewed_at": "2026-10-10T14:28:10Z",
      "statement": "用户确认此前列出的8类待核依赖均已核查，并要求全部纳入分类。",
      "scope": "8类依赖均作为已核验范围条目纳入；不据此补造具体产品身份、版本或任务效果等级。"
    },
    "objects": [
      {
        "id": "dep-pi-cli",
        "name": "Pi Agent CLI（当前 PATH 实例）",
        "type_id": "software-artifact",
        "graph_node": "2.1 Agent运行时 / Pi Agent",
        "identity_status": "runtime_observed",
        "version": "1.1.0",
        "evidence": "pi --version 输出 1.1.0；type -a 显示多个同名入口，本记录只绑定当前 shell 选中的入口；先前环境记录为 1.0.4，宿主/路径差异待核，不将此版本绑定到会话服务端。",
        "resource_ids": [],
        "related_object_id": null,
        "grade_id": null,
        "grade_status": "pending",
        "grade_reason": "分级量表仍为 draft，初/中/高结果带阈值未校准；本条未建立任务族效果合同。"
      },
      {
        "id": "dep-codex-cli",
        "name": "Codex CLI（依赖图替代项）",
        "type_id": "software-artifact",
        "graph_node": "2.1 Agent运行时 / Codex替代项",
        "identity_status": "named_candidate",
        "version": null,
        "evidence": "依赖图及外部资源行指向 Codex CLI 候选；当前安装身份、可执行入口、版本与来源未核。",
        "resource_ids": ["tools-platforms-codex-cli-362bc20a"],
        "related_object_id": null,
        "grade_id": null,
        "grade_status": "pending",
        "grade_reason": "精确实现/版本、任务合同及分级量表阈值待核。"
      },
      {
        "id": "dep-claude-code",
        "name": "Claude Code（依赖图替代项）",
        "type_id": "software-artifact",
        "graph_node": "2.1 Agent运行时 / Claude Code替代项",
        "identity_status": "named_candidate",
        "version": null,
        "evidence": "依赖图及外部资源行指向 Claude Code 候选；当前安装身份、可执行入口、版本与来源未核。",
        "resource_ids": ["tools-platforms-claude-code-11b1e88d"],
        "related_object_id": null,
        "grade_id": null,
        "grade_status": "pending",
        "grade_reason": "精确实现/版本、任务合同及分级量表阈值待核。"
      },
      {
        "id": "dep-wsl2-platform",
        "name": "WSL 2 承载平台",
        "type_id": "software-artifact",
        "graph_node": "6.1 Windows主机 / WSL",
        "identity_status": "runtime_observed",
        "version": null,
        "evidence": "uname -r 含 microsoft-standard-WSL2，确认当前 Linux 内核运行在 WSL2 兼容环境；Windows宿主版本及 WSL 产品版本未核。",
        "resource_ids": [],
        "related_object_id": null,
        "grade_id": null,
        "grade_status": "pending",
        "grade_reason": "承载平台精确版本、任务合同及分级量表阈值待核。"
      },
      {
        "id": "dep-ubuntu-userland",
        "name": "Ubuntu 用户空间发行版",
        "type_id": "software-artifact",
        "graph_node": "6.1 Linux发行版 / Ubuntu",
        "identity_status": "runtime_observed",
        "version": "24.04.3 LTS",
        "evidence": "/etc/os-release 报告 Ubuntu 24.04.3 LTS（VERSION_ID=24.04）。",
        "resource_ids": [],
        "related_object_id": null,
        "grade_id": null,
        "grade_status": "pending",
        "grade_reason": "版本观测不等于具体任务效果；分级量表阈值未校准。"
      },
      {
        "id": "dep-wsl2-kernel",
        "name": "WSL2 Linux 内核",
        "type_id": "software-artifact",
        "graph_node": "6.1 WSL / 版本对应的Linux内核",
        "identity_status": "runtime_observed",
        "version": "6.6.87.2-microsoft-standard-WSL2",
        "evidence": "uname -r 输出 6.6.87.2-microsoft-standard-WSL2；不据内核版本推断 Windows/WSL 产品版本。",
        "resource_ids": [],
        "related_object_id": null,
        "grade_id": null,
        "grade_status": "pending",
        "grade_reason": "版本观测不等于具体任务效果；分级量表阈值未校准。"
      },
      {
        "id": "dep-bash",
        "name": "GNU Bash",
        "type_id": "software-artifact",
        "graph_node": "6.2 Shell与命令解释器",
        "identity_status": "runtime_observed",
        "version": "5.2.21",
        "evidence": "bash --version 输出 GNU bash 5.2.21。",
        "resource_ids": [],
        "related_object_id": null,
        "grade_id": null,
        "grade_status": "pending",
        "grade_reason": "版本观测不等于具体任务效果；分级量表阈值未校准。"
      },
      {
        "id": "dep-python-runtime",
        "name": "Python 运行时",
        "type_id": "software-artifact",
        "graph_node": "4.3 语言与运行时",
        "identity_status": "runtime_observed",
        "version": "3.12.3",
        "evidence": "python3 --version 输出 Python 3.12.3。",
        "resource_ids": [],
        "related_object_id": null,
        "grade_id": null,
        "grade_status": "pending",
        "grade_reason": "版本观测不等于具体任务效果；分级量表阈值未校准。"
      },
      {
        "id": "dep-nodejs-runtime",
        "name": "Node.js 运行时",
        "type_id": "software-artifact",
        "graph_node": "4.3 语言与运行时",
        "identity_status": "runtime_observed",
        "version": "22.23.2",
        "evidence": "node --version 输出 v22.23.2。",
        "resource_ids": [],
        "related_object_id": null,
        "grade_id": null,
        "grade_status": "pending",
        "grade_reason": "版本观测不等于具体任务效果；分级量表阈值未校准。"
      },
      {
        "id": "dep-npm-npx",
        "name": "npm / npx 工具",
        "type_id": "software-artifact",
        "graph_node": "4.2 包管理器与依赖解析器",
        "identity_status": "runtime_observed",
        "version": "10.9.8",
        "evidence": "npm --version 与 npx --version 均输出 10.9.8；登记为同一当前工具链版本观测，不把命令入口重复计数为两件法器。",
        "resource_ids": [],
        "related_object_id": null,
        "grade_id": null,
        "grade_status": "pending",
        "grade_reason": "版本观测不等于具体任务效果；分级量表阈值未校准。"
      },
      {
        "id": "dep-git-client",
        "name": "Git 本地客户端",
        "type_id": "software-artifact",
        "graph_node": "3.2 文件与代码 / Git本地客户端与工作树",
        "identity_status": "runtime_observed",
        "version": "2.43.0",
        "evidence": "git --version 输出 git version 2.43.0。",
        "resource_ids": [],
        "related_object_id": null,
        "grade_id": null,
        "grade_status": "pending",
        "grade_reason": "版本观测不等于具体任务效果；分级量表阈值未校准。"
      },
      {
        "id": "dep-gnu-make",
        "name": "GNU Make",
        "type_id": "software-artifact",
        "graph_node": "4.3 构建系统",
        "identity_status": "runtime_observed",
        "version": "4.3",
        "evidence": "make --version 输出 GNU Make 4.3。",
        "resource_ids": [],
        "related_object_id": null,
        "grade_id": null,
        "grade_status": "pending",
        "grade_reason": "版本观测不等于具体任务效果；分级量表阈值未校准。"
      },
      {
        "id": "dep-tmux-runtime",
        "name": "tmux 当前运行实例",
        "type_id": "software-artifact",
        "graph_node": "3.2 命令/终端 / tmux复用支路",
        "identity_status": "runtime_observed",
        "version": "3.4",
        "evidence": "tmux -V 输出 tmux 3.4；本次隔离 session smoke 不能证明二进制来自已登记 faqi-tmux 的固定源码修订。",
        "resource_ids": [],
        "related_object_id": "faqi-tmux",
        "grade_id": null,
        "grade_status": "pending",
        "grade_reason": "运行实例与固定源码身份尚未桥接；任务族结果带与分级量表阈值未校准。"
      }
    ],
    "local_links": [
      {"object_id": "faqi-codex-config-installer", "graph_node": "2.1 Agent运行时 / Codex替代项", "relationship": "本地配置辅助脚本；不是Codex CLI实现。"},
      {"object_id": "faqi-auto-skill-create", "graph_node": "2.3 Harness与上下文 / 可选Skill制作支路", "relationship": "实现仓内Skill骨架生成入口。"},
      {"object_id": "faqi-auto-skill-validate", "graph_node": "2.3 Harness与上下文 / 可选Skill制作支路", "relationship": "实现仓内Skill结构检查入口。"},
      {"object_id": "faqi-skill-seekers-adapter", "graph_node": "2.3 Harness与上下文 / Skill Seekers适配入口", "relationship": "适配到固定submodule源码；本机依赖状态另核。"},
      {"object_id": "faqi-skill-seekers", "graph_node": "2.3 Harness与上下文 / Skill Seekers上游程序", "relationship": "固定submodule中的上游程序实现。"},
      {"object_id": "faqi-claude-skill-init", "graph_node": "2.3 Harness与上下文 / 可选Skill制作支路", "relationship": "第三方Skill集合中的独立初始化脚本，不等于Claude Code运行时。"},
      {"object_id": "faqi-auto-tmux", "graph_node": "3.2 命令/终端 / auto-tmux封装", "relationship": "依赖PATH中的tmux CLI及Shell。"},
      {"object_id": "faqi-oh-my-tmux", "graph_node": "3.2 命令/终端 / oh-my-tmux配置", "relationship": "依赖tmux与Shell的可执行配置，不是tmux本体。"},
      {"object_id": "faqi-tmux", "graph_node": "3.2 命令/终端 / tmux CLI、Server、Socket", "relationship": "固定源码内容；本地运行实例来源桥接待核。"}
    ],
    "dependency_categories": [
      {"id": "dep-category-cloud-model-api", "node": "2.2 云端模型服务/API与固定模型版本", "disposition": "user_confirmed_in_scope", "reason": "用户确认此依赖类别已核并要求纳入；服务/API与模型制品仍分开登记；本次品级按Vibe Coding重要性分组，正式效能评级另行判断。"},
      {"id": "dep-category-local-model-stack", "node": "2.2 本地模型权重、Tokenizer与推理引擎", "disposition": "user_confirmed_in_scope", "reason": "用户确认此依赖类别已核并要求纳入；模型制品、Tokenizer与推理程序分别判断；本次品级按Vibe Coding重要性分组，正式效能评级另行判断。"},
      {"id": "dep-category-terminal-pty", "node": "3.2 Terminal Emulator / PTY", "disposition": "user_confirmed_in_scope", "reason": "用户确认此依赖类别已核并要求纳入；终端模拟器与PTY系统接口分开分类；本次品级按Vibe Coding重要性分组，正式效能评级另行判断。"},
      {"id": "dep-category-package-sources", "node": "4.2 包注册表、Git源与可信缓存", "disposition": "user_confirmed_in_scope", "reason": "用户确认此依赖类别已核并要求纳入；注册表、Git来源与缓存分开分类；本次品级按Vibe Coding重要性分组，正式效能评级另行判断。"},
      {"id": "dep-category-ci-platform", "node": "7.1 Git托管、CI Runner与CI/CD平台", "disposition": "user_confirmed_in_scope", "reason": "用户确认此依赖类别已核并要求纳入；托管服务、Runner执行环境与CI/CD平台分开分类；本次品级按Vibe Coding重要性分组，正式效能评级另行判断。"},
      {"id": "dep-category-deployment-data", "node": "7.2-7.3 制品注册表、部署目标、产品运行时、数据库与外部API", "disposition": "user_confirmed_in_scope", "reason": "用户确认此可选依赖类别已核并要求纳入；注册表、部署环境、运行时、数据库与外部API分别分类；本次品级按Vibe Coding重要性分组，正式效能评级另行判断。"},